{
  "estados": [
    {
      "name": "Afligido",
      "buff": false,
      "tag": "[Xd daño]",
      "flavor": "El veneno, el fuego o las heridas te consumen poco a poco.",
      "mec": "Al final de cada turno sufres el daño indicado entre corchetes (cada 10 s fuera de combate). Acumulable: puedes estar Afligido por varios efectos a la vez, resueltos por separado."
    },
    {
      "name": "Agotado",
      "buff": false,
      "tag": "[−N] acumulable",
      "flavor": "La fatiga lastra cada uno de tus movimientos.",
      "mec": "Aplica una penalización igual a [−N] al resultado de tus pruebas (antes de resolver efectos). Acumulable: las penalizaciones se suman. Reduce la penalización en 1 tras cada descanso largo; se elimina al llegar a 0."
    },
    {
      "name": "Aturdido",
      "buff": false,
      "tag": "",
      "flavor": "Un golpe certero te deja momentáneamente fuera de combate.",
      "mec": "Pierdes tus reacciones y, en tu turno, obtienes 2 acciones menos y ninguna reacción. Fuera de combate, reaccionas con lentitud (a discreción de la DJ)."
    },
    {
      "name": "Concentrado",
      "buff": true,
      "tag": "beneficioso",
      "flavor": "Estás absorto y enfocado en tu tarea.",
      "mec": "Cuando usas una habilidad que cuesta concentración, su coste se reduce en 1 punto."
    },
    {
      "name": "Desorientado",
      "buff": false,
      "tag": "",
      "flavor": "Tus sentidos se nublan y el mundo se vuelve confuso.",
      "mec": "No puedes usar reacciones, tus sentidos cuentan siempre como ofuscados, y sufres desventaja en pruebas de Percepción (y similares que usen los sentidos)."
    },
    {
      "name": "Empoderado",
      "buff": true,
      "tag": "beneficioso · Radiante",
      "flavor": "Juras un Ideal y la luz tormentosa te colma de poder.",
      "mec": "Obtienes ventaja en todas las pruebas y tu Investidura se recarga hasta el máximo al inicio de cada turno. Se elimina al final de la escena."
    },
    {
      "name": "Inconsciente",
      "buff": false,
      "tag": "",
      "flavor": "Caes derribado, ajeno a cuanto te rodea.",
      "mec": "Movimiento 0; no te mueves ni te comunicas. Quedas Tumbado y sueltas lo que sostienes. Solo puedes usar Absorber luz tormentosa y Revitalizar (si eres Radiante). Puedes despertar al final de un turno o al curarte 1+ de salud (si tienes 0, recuperas 1)."
    },
    {
      "name": "Inmovilizado",
      "buff": false,
      "tag": "",
      "flavor": "Algo te ancla en el sitio.",
      "mec": "Tu valor de movimiento pasa a 0 y no te puedes mover ni ser movido por otros efectos."
    },
    {
      "name": "Mejorado",
      "buff": true,
      "tag": "[Atributo +N] acumulable",
      "flavor": "La Investidura o un efecto realza tus capacidades.",
      "mec": "El atributo indicado sube +N temporalmente (afecta a pruebas, talentos y movimiento que lo usen), pero NO cambia defensas, salud, concentración ni Investidura máximas. Acumulable y combinable entre atributos."
    },
    {
      "name": "Ralentizado",
      "buff": false,
      "tag": "",
      "flavor": "Tus movimientos se vuelven pesados y lentos.",
      "mec": "Tu valor de movimiento se reduce a la mitad. Si te ralentizan a mitad de un movimiento, el restante se reduce a la mitad (redondeando hacia arriba)."
    },
    {
      "name": "Resuelto",
      "buff": true,
      "tag": "beneficioso",
      "flavor": "Una determinación inquebrantable te impulsa.",
      "mec": "Cuando fallas una prueba, puedes añadir una Oportunidad al resultado. Tras elegir hacerlo, se elimina el estado."
    },
    {
      "name": "Retenido",
      "buff": false,
      "tag": "",
      "flavor": "Ataduras o un agarre te sujetan con fuerza.",
      "mec": "Tu valor de movimiento pasa a 0. Sufres desventaja en todas las pruebas, salvo en las que buscan liberarte de las ataduras."
    },
    {
      "name": "Sorprendido",
      "buff": false,
      "tag": "",
      "flavor": "El ataque te pilla totalmente desprevenido.",
      "mec": "Pierdes todas las reacciones, no obtienes reacción al inicio del combate ni en tu turno, no puedes jugar turno rápido y obtienes 1 acción menos. Se elimina tras tu próximo turno."
    },
    {
      "name": "Tumbado",
      "buff": false,
      "tag": "",
      "flavor": "Acabas en el suelo, en mala posición.",
      "mec": "Estás Ralentizado y los ataques cuerpo a cuerpo contra ti tienen ventaja. Puedes usar Prevenirse sin cobertura. Levantarte es acción gratuita (reduce tu movimiento en 1,5 m hasta tu siguiente turno)."
    }
  ],
  "lesiones": [
    [
      "–6 o menos",
      "<b>Muerte.</b> Tu personaje muere."
    ],
    [
      "–5 a 0",
      "<b>Lesión permanente.</b> No sana sin intervención sobrenatural."
    ],
    [
      "1 a 5",
      "<b>Lesión grave.</b> Temporal, dura 6d6 días."
    ],
    [
      "6 a 15",
      "<b>Lesión leve.</b> Temporal, dura 1d6 días."
    ],
    [
      "16 o más",
      "<b>Herida superficial.</b> Temporal hasta un descanso largo."
    ]
  ],
  "lesionesEsquirla": [
    [
      "16 o más",
      "<b>Herida superficial.</b> Temporal durante el resto del día."
    ],
    [
      "1 a 15",
      "<b>Lesión espiritual.</b> Permanente; la curación no Investida no la sana."
    ],
    [
      "0 o menos",
      "<b>Muerte.</b> El personaje muere."
    ]
  ],
  "efectosLesion": [
    [
      "1–2",
      "Agotado [−1]"
    ],
    [
      "3",
      "Agotado [−2]"
    ],
    [
      "4–5",
      "Ralentizado (pierna/pie)"
    ],
    [
      "6",
      "Desorientado (cabeza/sentidos)"
    ],
    [
      "7",
      "Sorprendido (conmoción)"
    ],
    [
      "8",
      "Solo puedes usar una mano"
    ]
  ]
}
